{
    "$schema": "../../../models/schemas/namespaces/validation.schema.json",
    "description": "Customize password validation rules for your users.",
    "fetchValidationConfigData": {
        "error": {
            "description": "{{description}}",
            "message": "Retrieval error"
        },
        "genericError": {
            "description": "Couldn't retrieve validation configuration data.",
            "message": "Something went wrong"
        }
    },
    "goBackToApplication": "Go back to application",
    "goBackToValidationConfig": "Go back to Account Security",
    "notifications": {
        "error": {
            "description": "{{description}}",
            "message": "Update error"
        },
        "genericError": {
            "description": "Failed to update password validation configuration.",
            "message": "Something went wrong"
        },
        "success": {
            "description": "Successfully updated password validation configuration.",
            "message": "Update successful"
        }
    },
    "pageTitle": "Password Validation",
    "passwordExpiry": {
        "enforcementScope": {
            "appWithEnforcer": {
                "hint": "Password expiry will only be enforced in login flows where the Password Reset Enforcer is added as an authentication step. Organization-wide enforcement will be disabled.",
                "label": "Selected application login flows"
            },
            "heading": "Enforce password expiry for",
            "orgWide": {
                "hint": "Password expiry is enforced globally at sign-in across all applications. If a user signs in after their password has expired, they will be required to change their password at the end of the login flow.",
                "label": "All application login flows"
            }
        },
        "heading": "Password Expiration",
        "rules": {
            "actions": {
                "apply": "Apply",
                "skip": "Skip"
            },
            "attributes": {
                "groups": "Groups",
                "roles": "Roles"
            },
            "buttons": {
                "addRule": "Add Rule",
                "deleteRule": "Delete Rule"
            },
            "messages": {
                "applyMessage": "days password expiry.",
                "defaultRuleApplyMessage": "days password expiry if no other rules match to the user.",
                "defaultRuleSkipMessage": "password expiry if no other rules match to the user.",
                "ifUserHas": "If user belongs to",
                "info": "Rules will be applied in the order listed below, from top to bottom. Use the arrows to adjust the priority.",
                "skipMessage": "password expiry."
            }
        }
    },
    "revertValidationConfigData": {
        "error": {
            "description": "Error occurred while reverting validation configurations.",
            "message": "Revert failed"
        },
        "success": {
            "description": "Successfully reverted validation configurations.",
            "message": "Revert successful"
        }
    },
    "validationError": {
        "consecutiveChrMismatch": "Number of consecutive characters should be less than tha minimum length of the password.",
        "invalidConfig": "Unable to create password with the above configurations.",
        "maxLimitError": "The maximum length cannot be more than {{maxPasswordValue}}.",
        "minLimitError": "The minimum length cannot be less than 8.",
        "minMaxMismatch": "Minimum length should be less than maximum length.",
        "uniqueChrMismatch": "Number of unique characters should be less than tha minimum length of the password.",
        "wrongCombination": "The combination is not allowed"
    }
}
